A1: LEI 9.109/2009 - TABELA DE CUSTAS E EMOLUMENTOS
A2: (Alterada pela lei Resolução 55/2010 e pela Lei 9.490/2011 - TJ)
G3: INDÍCE PARA 2013 | H3: =5.95532/100 -> 5.9553200000000001E-2
A5: TABELA XIII
A6: DOS SERVIÇOS EXTRAJUDCIAIS – DOS ATOS DOS TABELIONATOS DE NOTAS
D7: =IF('\Users\mfsouto\Desktop\PROJETOS 2012\[Tabela de emolumentos 2012 - Final.xls]Tabela atualizada 2012'!B544<>"",'\Users\mfsouto\Desktop\PROJETOS 2012\[Tabela de emolumentos 2012 - Final.xls]Tabela atualizada 2012'!B544,"") -> #REF! | E7: =IF('\Users\mfsouto\Desktop\PROJETOS 2012\[Tabela de emolumentos 2012 - Final.xls]Tabela atualizada 2012'!C544<>"",'\Users\mfsouto\Desktop\PROJETOS 2012\[Tabela de emolumentos 2012 - Final.xls]Tabela atualizada 2012'!C544,"") -> #REF!
A8: Cód. Lei | B8: Atos | C8: Emolumentos | D8: FERC | E8: TOTAL
A9: 13.1 | B9: Escritura completa, compreendendo todos os atos necessários inclusive fornecimento do primeiro traslado (com base no valor do ato):
A10: 13.1.1 | B10: Ate R$ 7.800,00 | C10: 92.8 | D10: 2.8 | E10: =C10+D10 -> 95.6
A11: 13.1.2 | B11: De R$ 7.800,01 a R$ 9.750,00 | C11: 104.8 | D11: 3.1 | E11: =C11+D11 -> 107.9
A12: 13.1.3 | B12: De R$ 9.750,01 a R$ 12.187,50 | C12: 131 | D12: 3.9 | E12: =C12+D12 -> 134.9
A13: 13.1.4 | B13: De R$ 12.187,51 a R$ 15.234,37 | C13: 163.1 | D13: 4.9 | E13: =C13+D13 -> 168
A14: 13.1.5 | B14: De R$ 15.234,38 a R$ 19.042,96 | C14: 203.5 | D14: 6.1 | E14: =C14+D14 -> 209.6
A15: 13.1.6 | B15: De R$ 19.042,97 a R$ 23.803,71 | C15: 254.8 | D15: 7.6 | E15: =C15+D15 -> 262.4
A16: 13.1.7 | B16: De R$ 23.803,72 a R$ 29.754,63 | C16: 319.1 | D16: 9.6 | E16: =C16+D16 -> 328.7
A17: 13.1.8 | B17: De R$ 29.754,64 a R$ 37.193,28 | C17: 398.8 | D17: 12 | E17: =C17+D17 -> 410.8
A18: 13.1.9 | B18: De R$ 37.193,29 a R$ 46.491,60 | C18: 497.7 | D18: 14.9 | E18: =C18+D18 -> 512.6
A19: 13.1.10 | B19: De R$ 46.491,61 a R$ 58.114,50 | C19: 622.7 | D19: 18.7 | E19: =C19+D19 -> 641.4
A20: 13.1.11 | B20: De R$ 58.114,51 a R$ 72.643,12 | C20: 778.7 | D20: 23.4 | E20: =C20+D20 -> 802.1
A21: 13.1.12 | B21: De R$ 72.643,13 a R$ 90.803,90 | C21: 972.7 | D21: 29.2 | E21: =C21+D21 -> 1001.9
A22: 13.1.13 | B22: De R$ 90.803,91 a R$ 113.504,88 | C22: 1216.8 | D22: 36.5 | E22: =C22+D22 -> 1253.3
A23: 13.1.14 | B23: De R$ 113.504,89 a R$ 141.881,10 | C23: 1520.4 | D23: 45.6 | E23: =C23+D23 -> 1566
A24: 13.1.15 | B24: De R$ 141.881,11 a R$ 177.351,37 | C24: 1900.1 | D24: 57 | E24: =C24+D24 -> 1957.1
A25: 13.1.16 | B25: De R$ 177.351,38 a R$ 221.689,21 | C25: 2375.2 | D25: 71.3 | E25: =C25+D25 -> 2446.5
A26: 13.1.17 | B26: De R$ 221.689,22 a R$ 277.111,51 | C26: 2969.3 | D26: 89.1 | E26: =C26+D26 -> 3058.4
A27: 13.1.18 | B27: De R$ 277.111.52 a R$ 346.389,40 | C27: 3712.1 | D27: 111.4 | E27: =C27+D27 -> 3823.5
A28: 13.1.19 | B28: De R$ 346.389,41 a R$ 432.986,76 | C28: 4639.6 | D28: 139.2 | E28: =C28+D28 -> 4778.8
A29: 13.1.20 | B29: De R$ 432.986,77 a R$ 541.233,46 | C29: 5799.3 | D29: 174 | E29: =C29+D29 -> 5973.3
A30: 13.1.21 | B30: De R$ 541.233,47 a R$ 676.541,83 | C30: 7249.3 | D30: 217.5 | E30: =C30+D30 -> 7466.8
A31: 13.1.22 | B31: Acima de R$ 676.541,83 | C31: 7655.3 | D31: 229.7 | E31: =C31+D31 -> 7885
A33: 13.2 | B33: Escritura completa, compreendendo todos os atos necessários inclusive fornecimento do primeiro traslado, sem valor econômico. | C33: 139.3 | D33: 4.2 | E33: =C33+D33 -> 143.5
A35: 13.3 | B35: Escritura completa de permuta de bens, a base de cálculo será o somatório dos bens. (Alterado pela Lei nº 9.490, de 04/11/11) | C35: Informar Valor da Transação
A37: 13.4 | B37: Havendo, na escritura, mais de um contrato ou estipulação que, por sua autonomia, possa ser objeto de outra escritura, os valores serão cobrados separadamente. (Alterado pela Lei nº 9.490, de 04/11/11) | C37: Orientação Informativa
A39: 13.5 | B39: Os emolumentos referidos nos itens anteriores desta tabela serão calculados com base no valor declarado ou com base na avaliação oficial da Fazenda Pública, o que for maior ou, ainda, pelo preço de mercado, caso a avaliação não seja exigível ou for com este incompatível. (Alterado pela Lei nº 9.490, de 04/11/11) | C39: Orientação Informativa
A41: 13.6 | B41: Os emolumentos devidos aos tabelionatos de notas nos atos relacionados à aquisição imobiliária para fins residenciais, oriundas de programas e convênios com a União, Estados, Distrito Federal e Municípios, para a construção de habitações populares destinadas a famílias de baixa renda, pelo sistema de mutirão e autoconstrução orientada, serão reduzidos para vinte por cento da tabela cartorária normal, considerando o imóvel limitado a até sessenta e nove metros quadrados de área construída, em terreno de até duzentos e cinquenta metros quadrados. (§ 4º do art. 290 da Lei nº 6.015, de 31 de dezembro de 1973. | C41: Orientação Informativa
A43: 13.7 | B43: Escritura de separação e divórcio sem bens a partilhar | C43: 83.3
A45: 13.8 | B45: Escritura de separação, divórcio, partilha e inventário, os emolumentos são os mesmos do item 13.1 com base no valor dos bens. | C45: Informar Valor da Transação
A47: 13.9 | B47: Procurações, incluindo o primeiro traslado, figurando apenas uma pessoa ou casal como outorgante:
A48: 13.9.1 | B48: Em causa própria, as custas serão as mesmas do item 13.1, reduzidas em cinquenta por cento. | C48: Informar Valor da Transação
A49: 13.9.2 | B49: Procuração outorgada com poderes para assinatura de contrato com instituição financeira para obtenção de empréstimo junto a Programas de Agricultura Familiar, para Programas de Assistência do Governo e para fins previdenciários. | C49: 17.8 | D49: 0.5 | E49: =C49+D49 -> 18.3
A50: 13.9.3 | B50: Outras procurações | C50: 62 | D50: 1.9 | E50: =C50+D50 -> 63.9
A51: 13.9.4 | B51: No caso de procurações com mais de uma pessoa, exceto o casal que se considera como apenas um outorgante, serão acrescidos aos emolumentos finais, por pessoa, | C51: 7.2 | D51: 0.2 | E51: =C51+D51 -> 7.4
A52: 13.9.5 | B52: Nos substabelecimentos de procurações | C52: 32.2 | D52: 1 | E52: =C52+D52 -> 33.2
A53: 13.9.6 | B53: Revogação de procuração e de substabelecimento por renúncia do mandato ou cassação | C53: 23.8 | D53: 0.7 | E53: =C53+D53 -> 24.5
A55: 13.10 | B55: Testamento, incluindo traslado e certidão:
A56: 13.10.1 | B56: Público sem conteúdo patrimonial | C56: 59.5 | D56: 1.8 | E56: =C56+D56 -> 61.3
A57: 13.10.2 | B57: Público com valor patrimonial | C57: 386.9 | D57: 11.6 | E57: =C57+D57 -> 398.5
A58: 13.10.3 | B58: Cerrado, incluindo todos os atos necessários. | C58: 77.3 | D58: 2.3 | E58: =C58+D58 -> 79.6
A59: 13.10.4 | B59: Revogação de testamento. | C59: 77.3 | D59: 2.3 | E59: =C59+D59 -> 79.6
A60: 13.10.5 | B60: Modificação de cláusula de testamento, incluindo traslado e certidão | C60: 77.3 | D60: 2.3 | E60: =C60+D60 -> 79.6
A62: 13.11 | B62: Escritura de constituição ou de especificação de condomínio em plano horizontal e suas modificações por convenção | C62: 131 | D62: 3.9 | E62: =C62+D62 -> 134.9
A63: 13.11.1 | B63: Por unidade autônoma, o apartamento e as vagas na garagem que o servem, será acrescido de | C63: 14.3 | D63: 0.4 | E63: =C63+D63 -> 14.7
A65: 13.12 | B65: Certidões ou traslado:
A66: 13.12.1 | B66: Com uma folha | C66: 23.8 | D66: 0.7 | E66: =C66+D66 -> 24.5
A67: 13.12.2 | B67: Por pessoa acrescida na certidão, que não sejam marido e mulher, representante e representado, mais | C67: 4.8 | D67: 0.1 | E67: =C67+D67 -> 4.9
A68: 13.12.3 | B68: Por folha acrescida além da primeira, mais | C68: 4.8 | D68: 0.1 | E68: =C68+D68 -> 4.9
A70: 13.13 | B70: Das buscas:
A71: 13.13.1 | B71: Até dois anos | C71: 3.6 | D71: 0.1 | E71: =C71+D71 -> 3.7
A72: 13.13.2 | B72: Até cinco anos | C72: 5.9 | D72: 0.2 | E72: =C72+D72 -> 6.1
A73: 13.13.3 | B73: Até dez anos | C73: 9.5 | D73: 0.3 | E73: =C73+D73 -> 9.8
A74: 13.13.4 | B74: Até quinze anos | C74: 12 | D74: 0.4 | E74: =C74+D74 -> 12.4
A75: 13.13.5 | B75: Até vinte anos | C75: 15.5 | D75: 0.5 | E75: =C75+D75 -> 16
A76: 13.13.6 | B76: Até trinta anos | C76: 20.2 | D76: 0.6 | E76: =C76+D76 -> 20.8
A77: 13.13.7 | B77: Até cinquenta anos | C77: 23.8 | D77: 0.7 | E77: =C77+D77 -> 24.5
A78: 13.13.8 | B78: Acima de cinquenta anos | C78: 30.9 | D78: 0.9 | E78: =C78+D78 -> 31.8
A79: 13.13.9 | B79: Se indicados dia, mês e ano da prática do ato, não serão cobradas buscas. | C79: Orientação Informativa
A81: 13.14 | B81: Atas Notariais:
A82: 13.14.1 | B82: Pela primeira folha | C82: 119.1 | D82: 3.6 | E82: =C82+D82 -> 122.7
A83: 13.14.2 | B83: Por folha que exceder | C83: 59.5 | D83: 1.8 | E83: =C83+D83 -> 61.3
A85: 13.15 | B85: Averbação de qualquer natureza | C85: 12 | D85: 0.4 | E85: =C85+D85 -> 12.4
A87: 13.16 | B87: Retificação e/ou ratificação ou qualquer outro ato destinado a integrar escritura anteriormente lavrada | C87: 46.4 | D87: 1.4 | E87: =C87+D87 -> 47.8
A89: 13.17 | B89: Registro de firma – cadastro
A90: 13.17.1 | B90: Cadastro | C90: 5.9 | D90: 0.2 | E90: =C90+D90 -> 6.1
A91: 13.17.2 | B91: Reconhecimento de sinal, letra e firma ou somente de firma, por assinatura | C91: 3 | D91: 0.1 | E91: =C91+D91 -> 3.1
A92: 13.17.3 | B92: Reconhecimento de firma, por assinatura, em documento de transferência, mandato ou quitação de veículos automotores | C92: 17.8 | D92: 0.5 | E92: =C92+D92 -> 18.3
A94: 13.18 | B94: Autenticação de cópias de documentos extraídas por meio reprográfico, por página | C94: 3 | D94: 0.1 | E94: =C94+D94 -> 3.1
A97: TABELA XIV
A98: DOS SERVIÇOS EXTRAJUDCIAIS – DOS ATOS DO REGISTRO CIVIL DAS PESSOAS NATURAIS
D99: =IF('\Users\mfsouto\Desktop\PROJETOS 2012\[Tabela de emolumentos 2012 - Final.xls]Tabela atualizada 2012'!B638<>"",'\Users\mfsouto\Desktop\PROJETOS 2012\[Tabela de emolumentos 2012 - Final.xls]Tabela atualizada 2012'!B638,"") -> #REF!
A100: 14.1 | B100: Casamento:
A101: 14.1.1 | B101: Habilitação e registro, lavratura de assento de casamento, inclusive o religioso com efeitos civis, e conversão de união estável em casamento, compreendendo todas as despesas, com fornecimento de uma certidão, exceto com editais | C101: 108.3 | D101: 3.2 | E101: =C101+D101 -> 111.5
A102: 14.1.2 | B102: Afixação, publicação e arquivamento de edital remetido por oficial de outra circunscrição e fornecimento da respectiva certidão, excluídas as despesas de publicação na imprensa quando necessário | C102: 23.8 | D102: 0.7 | E102: =C102+D102 -> 24.5
A103: 14.1.3 | B103: Diligência quando o casamento for celebrado fora da serventia – na zona urbana | C103: 15.5 | D103: 0.5 | E103: =C103+D103 -> 16
A104: 14.1.4 | B104: Diligência quando o casamento for celebrado fora da serventia – na zona rural | C104: 30.9 | D104: 0.9 | E104: =C104+D104 -> 31.8
A105: 14.1.5 | B105: Habilitação de casamento a ser realizado em outra serventia, inclusive o preparo de papéis, excluídas as despesas com publicação na imprensa | C105: 77.3 | D105: 2.3 | E105: =C105+D105 -> 79.6
A106: 14.1.6 | B106: Lavratura de assento de casamento a vista de certidão de habilitação emitida por outra serventia e expedição da respectiva certidão | C106: 41.7 | D106: 1.3 | E106: =C106+D106 -> 43
A107: 14.1.7 | B107: Dispensa total ou parcial de edital de proclamas | C107: 15.5 | D107: 0.5 | E107: =C107+D107 -> 16
A108: 14.1.8 | B108: Serão isentos de quaisquer emolumentos todos os atos necessários à realização do projeto Casamentos Comunitários organizado pelo Poder Judiciário do Maranhão.
A110: 14.a | B110: Registro de nascimento, bem como pela primeira certidão respectiva. Isento. (Incluído pela Lei nº 9.490, de 04/11/11)
A112: 14.b | B112: Registro de nascimento realizado pelas Centrais ou Postos de Registro, bem como pela primeira certidão respectiva. Isento. (Incluído pela Lei nº 9.490, de 04/11/11)
A114: 14.c | B114: Assento de óbito, bem como pela primeira certidão respectiva. Isento. (Incluído pela Lei nº 9.490, de 04/11/11)
A116: 14.d | B116: Assento de natimorto, bem como pela primeira certidão respectiva. Isento. (Incluído pela Lei nº 9.490, de 04/11/11)
A118: 14.2 | B118: Registro de emancipação, tutela, interdição ou ausência. (Alterado pela Lei nº 9.490, de 04/11/11) | C118: 39.3 | D118: 1.2 | E118: =C118+D118 -> 40.5
A120: 14.3 | B120: Das transcrições:
A121: 14.3.1 | B121: Transcrição de assento de nascimento, casamento e óbito ocorridos no exterior | C121: 23.8 | D121: 0.7 | E121: =C121+D121 -> 24.5
A122: 14.3.2 | B122: Transcrição de termo de opção pela nacionalidade brasileira | C122: 30.9 | D122: 0.9 | E122: =C122+D122 -> 31.8
A123: 14.3.3 | B123: Retificação, restauração ou cancelamento de registro, qualquer que seja a causa e alteração de patronímico familiar. (Alterado pela Lei nº 9.490, de 04/11/11) | C123: 30.9 | D123: 0.9 | E123: =C123+D123 -> 31.8
A124: 14.3.4 | B124: Procedimento de adoção e reconhecimento de filho, incluída a certidão | C124: 39.3 | D124: 1.2 | E124: =C124+D124 -> 40.5
A126: 14.4 | B126: Das averbações em geral:
A127: 14.4.1 | B127: Quando lavrada à margem do registro | C127: 19.1 | D127: 0.6 | E127: =C127+D127 -> 19.7
A128: 14.4.2 | B128: Quando houver necessidade de transporte para outra folha | C128: 23.8 | D128: 0.7 | E128: =C128+D128 -> 24.5
A129: 14.4.3 | B129: Quando for referente à anulação de casamento, separação judicial, divórcio ou restabelecimento de sociedade conjugal | C129: 23.8 | D129: 0.7 | E129: =C129+D129 -> 24.5
A131: 14.5 | B131: Das certidões:
A132: 14.5.1 | B132: Com uma folha | C132: 23.8 | D132: 0.7 | E132: =C132+D132 -> 24.5
A133: 14.5.2 | B133: Por folha acrescida além da primeira, mais | C133: 4.8 | D133: 0.1 | E133: =C133+D133 -> 4.9
A134: 14.5.3 | B134: Por pessoa acrescida na certidão, que não sejam marido e mulher, representante e representado, mais | C134: 4.8 | D134: 0.1 | E134: =C134+D134 -> 4.9
A136: 14.6 | B136: Das buscas:
A137: 14.6.1 | B137: Até dois anos | C137: 3.6 | D137: 0.1 | E137: =C137+D137 -> 3.7
A138: 14.6.2 | B138: Até cinco anos | C138: 5.9 | D138: 0.2 | E138: =C138+D138 -> 6.1
A139: 14.6.3 | B139: Até dez anos | C139: 9.5 | D139: 0.3 | E139: =C139+D139 -> 9.8
A140: 14.6.4 | B140: Até quinze anos | C140: 12 | D140: 0.4 | E140: =C140+D140 -> 12.4
A141: 14.6.5 | B141: Até vinte anos | C141: 15.5 | D141: 0.5 | E141: =C141+D141 -> 16
A142: 14.6.6 | B142: Até trinta anos | C142: 20.2 | D142: 0.6 | E142: =C142+D142 -> 20.8
A143: 14.6.7 | B143: Até cinquenta anos | C143: 23.8 | D143: 0.7 | E143: =C143+D143 -> 24.5
A144: 14.6.8 | B144: Acima de cinquenta anos | C144: 30.9 | D144: 0.9 | E144: =C144+D144 -> 31.8
A145: 14.6.9 | B145: Se indicados dia, mês e ano da prática do ato, não serão cobradas buscas. | C145: Orientação Informativa
A147: TABELA XV
A148: DOS SERVIÇOS EXTRAJUDCIAIS – DOS ATOS DO REGISTRO CIVIL DAS PESSOAS JURÍDICAS E DO REGISTRO DE TÍTULOS E DOCUMENTOS
D150: =IF('\Users\mfsouto\Desktop\PROJETOS 2012\[Tabela de emolumentos 2012 - Final.xls]Tabela atualizada 2012'!B691<>"",'\Users\mfsouto\Desktop\PROJETOS 2012\[Tabela de emolumentos 2012 - Final.xls]Tabela atualizada 2012'!B691,"") -> #REF!
A151: 15.1 | B151: Registro completo com as anotações e remissões de contrato, título ou documento com valor econômico declarado, trasladação na íntegra ou por extrato conforme requerido, incluído o fornecimento de uma certidão (sobre o valor declarado):
A152: 15.1.1 | B152: Ate R$ 7.057,14 | C152: 58.3 | D152: 1.7 | E152: =C152+D152 -> 60
A153: 15.1.2 | B153: De R$ 7.057,15 a R$ 8.821,42 | C153: 66.8 | D153: 2 | E153: =C153+D153 -> 68.8
A154: 15.1.3 | B154: De R$ 8.821,43 a R$ 11.026,78 | C154: 83.3 | D154: 2.5 | E154: =C154+D154 -> 85.8
A155: 15.1.4 | B155: De R$ 11.026,79 a R$ 13.783,48 | C155: 103.6 | D155: 3.1 | E155: =C155+D155 -> 106.7
A156: 15.1.5 | B156: De R$ 13.783,49 a R$ 17.229,35 | C156: 129.8 | D156: 3.9 | E156: =C156+D156 -> 133.7
A157: 15.1.6 | B157: De R$ 17.229,36 a R$ 21.536,68 | C157: 162 | D157: 4.9 | E157: =C157+D157 -> 166.9
A158: 15.1.7 | B158: De R$ 21.536,69 a R$ 26.920,85 | C158: 202.4 | D158: 6.1 | E158: =C158+D158 -> 208.5
A159: 15.1.8 | B159: De R$ 26.920,86 a R$ 33.651,06 | C159: 252.4 | D159: 7.6 | E159: =C159+D159 -> 260
A160: 15.1.9 | B160: De R$ 33.651,07 a R$ 42.063,82 | C160: 315.5 | D160: 9.5 | E160: =C160+D160 -> 325
A161: 15.1.10 | B161: De R$ 42.063,83 a R$ 52.579,77 | C161: 394 | D161: 11.8 | E161: =C161+D161 -> 405.8
A162: 15.1.11 | B162: De R$ 52.579,78 a R$ 65.724,72 | C162: 492.9 | D162: 14.8 | E162: =C162+D162 -> 507.7
A163: 15.1.12 | B163: De R$ 65.724,73 a R$ 82.155,90 | C163: 616.7 | D163: 18.5 | E163: =C163+D163 -> 635.2
A164: 15.1.13 | B164: De R$ 82.155,91 a R$ 102.694,87 | C164: 770.3 | D164: 23.1 | E164: =C164+D164 -> 793.4
A165: 15.1.14 | B165: De R$ 102.694,88 a R$ 128.368,59 | C165: 963.1 | D165: 28.9 | E165: =C165+D165 -> 992
A166: 15.1.15 | B166: De R$ 128.368,60 a R$ 160.460,75 | C166: 1203.7 | D166: 36.1 | E166: =C166+D166 -> 1239.8
A167: 15.1.16 | B167: De R$ 160.460,76 a R$ 200.575,95 | C167: 1504.9 | D167: 45.1 | E167: =C167+D167 -> 1550
A168: 15.1.17 | B168: De R$ 200.575,96 a R$ 250.719,95 | C168: 1879.9 | D168: 56.4 | E168: =C168+D168 -> 1936.3
A169: 15.1.18 | B169: De R$ 250.719,96 a R$ 313.399,95 | C169: 2350.2 | D169: 70.5 | E169: =C169+D169 -> 2420.7
A170: 15.1.19 | B170: De R$ 313.399,96 a R$ 391.749,94 | C170: 2938.2 | D170: 88.1 | E170: =C170+D170 -> 3026.3
A171: 15.1.20 | B171: De R$ 391.749,95 a R$ 489.687,42 | C171: 3672.8 | D171: 110.2 | E171: =C171+D171 -> 3783
A172: 15.1.21 | B172: De R$ 489.687,43 a R$ 612.109,28 | C172: 4590.8 | D172: 137.7 | E172: =C172+D172 -> 4728.5
A173: 15.1.22 | B173: De R$ 612.109,29 a R$ 765.136,60 | C173: 5738.4 | D173: 172.2 | E173: =C173+D173 -> 5910.6
A174: 15.1.23 | B174: De R$ 765.136,61 a R$ 956.420,75 | C174: 7173.1 | D174: 215.2 | E174: =C174+D174 -> 7388.3
A175: 15.1.24 | B175: Acima de R$ 956.420,75 | C175: 7655.3 | D175: 229.7 | E175: =C175+D175 -> 7885
A177: 15.2 | B177: No registro de contrato de alienação fiduciária, leasing ou reserva de domínio, os emolumentos cobrados serão os do item 15.1 (sobre o valor financiado). | C177: Informar Valor da Transação
A179: 15.3 | B179: Registro de título, contrato ou documento sem valor econômico, trasladação na íntegra ou por extrato conforme requerido, incluindo o fornecimento de uma certidão:
A180: 15.3.1 | B180: Até uma página | C180: 40.5 | D180: 1.2 | E180: =C180+D180 -> 41.7
A181: 15.3.2 | B181: Por página que exceder | C181: 10.7 | D181: 0.3 | E181: =C181+D181 -> 11
A183: 15.4 | B183: De contrato, estatuto ou qualquer outro constitutivo de sociedade, associação ou fundação com capital declarado ou fim econômico, serão sobrados os emolumentos do subitem 15.1
A185: 15.5 | B185: Registro de contrato, estatuto ou qualquer outro ato constitutivo de sociedade, associação ou fundação sem capital declarado ou fim econômico serão de
A186: 15.5.1 | B186: Até cinco páginas | C186: 101.2 | D186: 3 | E186: =C186+D186 -> 104.2
A187: 15.5.2 | B187: Por página que exceder | C187: 4.8 | D187: 0.1 | E187: =C187+D187 -> 4.9
A189: 15.6 | B189: Registro de jornais, periódicos, oficinas impressoras, empresas de radiodifusão e agências de notícias, pelo processamento e pela matrícula | C189: 270.3 | D189: 8.1 | E189: =C189+D189 -> 278.4
A191: 15.7 | B191: Registro de termos de abertura e encerramento em livros de contabilidade ou ato de sociedade civil, associação ou fundação, inclusive registro de atas | C191: 45.2 | D191: 1.4 | E191: =C191+D191 -> 46.6
A193: 15.8 | B193: Registro para fins de notificação extrajudicial, por destinatário. (Alterado pela Lei nº 9.490, de 04/11/11) | C193: 36.3 | D193: 1.1 | E193: =C193+D193 -> 37.4
A195: 15.8.1 | B195: Diligência para notificação extrajudicial, por destinatário. (Incluído pela Lei nº 9.490, de 04/11/11) | C195: 15.5 | D195: 0.5 | E195: =C195+D195 -> 16
A197: 15.8.2 | B197: Certidão à margem do registro, por destinatário. (Incluído pela Lei nº 9.490, de 04/11/11) | C197: 23.8 | D197: 0.7 | E197: =C197+D197 -> 24.5
A199: 15.9 | B199: Averbação de documento para integrar, modificar ou cancelar registro, com ou sem valor patrimonial, incluindo a certidão:
A200: 15.9.1 | B200: Pela primeira folha | C200: 45.2 | D200: 1.4 | E200: =C200+D200 -> 46.6
A201: 15.9.2 | B201: Por folha que exceder | C201: 9.5 | D201: 0.3 | E201: =C201+D201 -> 9.8
A203: 15.10 | B203: Das certidões:
A204: 15.10.1 | B204: Com uma folha | C204: 23.8 | D204: 0.7 | E204: =C204+D204 -> 24.5
A205: 15.10.2 | B205: Por folha acrescida além da primeira, mais | C205: 4.8 | D205: 0.1 | E205: =C205+D205 -> 4.9
A206: 15.10.3 | B206: Por pessoa acrescida na certidão, que não sejam marido e mulher, representante e representado, mais | C206: 4.8 | D206: 0.1 | E206: =C206+D206 -> 4.9
A208: 15.11 | B208: Das buscas:
A209: 15.11.1 | B209: Até dois anos | C209: 3.6 | D209: 0.1 | E209: =C209+D209 -> 3.7
A210: 15.11.2 | B210: Até cinco anos | C210: 5.9 | D210: 0.2 | E210: =C210+D210 -> 6.1
A211: 15.11.3 | B211: Até dez anos | C211: 9.5 | D211: 0.3 | E211: =C211+D211 -> 9.8
A212: 15.11.4 | B212: Até quinze anos | C212: 12 | D212: 0.4 | E212: =C212+D212 -> 12.4
A213: 15.11.5 | B213: Até vinte anos | C213: 15.5 | D213: 0.5 | E213: =C213+D213 -> 16
A214: 15.11.6 | B214: Até trinta anos | C214: 20.2 | D214: 0.6 | E214: =C214+D214 -> 20.8
A215: 15.11.7 | B215: Até cinquenta anos | C215: 23.8 | D215: 0.7 | E215: =C215+D215 -> 24.5
A216: 15.11.8 | B216: Acima de cinquenta anos | C216: 30.9 | D216: 0.9 | E216: =C216+D216 -> 31.8
A217: 15.11.9 | B217: Se indicados dia, mês e ano da prática do ato, não serão cobradas buscas. | C217: Orientação Informativa
A219: 15.12 | B219: No registro do contrato de aluguel os emolumentos serão os do item 15.1:
A220: 15.12.1 | B220: Se o contrato de aluguel for por período inferior a doze meses, a base de cálculo dos emolumentos será igual a soma de todas as mensalidades. | C220: Informar Valor da Transação
A221: 15.12.2 | B221: Se o contrato de aluguel for por período igual ou superior a doze meses ou ainda por prazo indeterminado, a base de cálculo será a soma de doze meses de aluguel. | C221: Informar Valor da Transação
A224: TABELA XVI
A225: DOS SERVIÇOS EXTRAJUDCIAIS – DOS ATOS DO REGISTRO DE IMÓVEIS
A227: 16.1 | B227: Prenotações de título levado a registro | C227: 19.1 | D227: 0.6 | E227: =C227+D227 -> 19.7
A229: 16.2 | B229: Matrícula de imóveis no Registro Geral, incluído fornecimento da primeira certidão | C229: 45.2 | D229: 1.4 | E229: =C229+D229 -> 46.6
A231: 16.3 | B231: Registros de atos com valor declarado, averbações necessárias e fornecimento da primeira certidão:
A232: 16.3.1 | B232: Ate R$ 5.200,00 | C232: 62 | D232: 1.9 | E232: =C232+D232 -> 63.9
A233: 16.3.2 | B233: De R$ 5.200,01 a R$ 6.500,00 | C233: 70.2 | D233: 2.1 | E233: =C233+D233 -> 72.3
A234: 16.3.3 | B234: De R$ 6.500,01 a R$ 8.125,00 | C234: 87 | D234: 2.6 | E234: =C234+D234 -> 89.6
A235: 16.3.4 | B235: De R$ 8.125,01 a R$ 10.156,25 | C235: 108.3 | D235: 3.2 | E235: =C235+D235 -> 111.5
A236: 16.3.5 | B236: De R$ 10.156,26 a R$ 12.695,31 | C236: 135.7 | D236: 4.1 | E236: =C236+D236 -> 139.8
A237: 16.3.6 | B237: De R$ 12.695,32 a R$ 15.869,13 | C237: 170.3 | D237: 5.1 | E237: =C237+D237 -> 175.4
A238: 16.3.7 | B238: De R$ 15.869,14 a R$ 19.836,41 | C238: 213.1 | D238: 6.4 | E238: =C238+D238 -> 219.5
A239: 16.3.8 | B239: De R$ 19.836,42 a R$ 24.795,51 | C239: 265.5 | D239: 8 | E239: =C239+D239 -> 273.5
A240: 16.3.9 | B240: De R$ 24.795,52 a R$ 30.994,39 | C240: 332.2 | D240: 10 | E240: =C240+D240 -> 342.2
A241: 16.3.10 | B241: De R$ 30.994,40 a R$ 38.742,98 | C241: 415.6 | D241: 12.5 | E241: =C241+D241 -> 428.1
A242: 16.3.11 | B242: De R$ 38.742,99 a 48.428,72 | C242: 519.1 | D242: 15.6 | E242: =C242+D242 -> 534.7
A243: 16.3.12 | B243: De R$ 48.428,73 a 60.535,90 | C243: 648.9 | D243: 19.5 | E243: =C243+D243 -> 668.4
A244: 16.3.13 | B244: De R$ 60.535,91 a R$ 75.669,87 | C244: 810.8 | D244: 24.3 | E244: =C244+D244 -> 835.1
A245: 16.3.14 | B245: De R$ 75.669,88 a R$ 94.587,33 | C245: 1013.1 | D245: 30.4 | E245: =C245+D245 -> 1043.5
A246: 16.3.15 | B246: De R$ 94.587,34 a R$ 118.234,16 | C246: 1266.8 | D246: 38 | E246: =C246+D246 -> 1304.8
A247: 16.3.16 | B247: De R$ 118.234,17 a R$ 147.792,71 | C247: 1583.5 | D247: 47.5 | E247: =C247+D247 -> 1631
A248: 16.3.17 | B248: De R$ 147.792,72 a R$ 184.740,89 | C248: 1979.9 | D248: 59.4 | E248: =C248+D248 -> 2039.3
A249: 16.3.18 | B249: De R$ 184.740,90 a R$ 230.926,11 | C249: 2474 | D249: 74.2 | E249: =C249+D249 -> 2548.2
A250: 16.3.19 | B250: De R$ 230.926,12 a R$ 288.657,64 | C250: 3093 | D250: 92.8 | E250: =C250+D250 -> 3185.8
A251: 16.3.20 | B251: De R$ 288.657,65 a R$ 360.822,05 | C251: 3865.8 | D251: 116 | E251: =C251+D251 -> 3981.8
A252: 16.3.21 | B252: De R$ 360.822,06 a R$ 451.027,56 | C252: 4832.4 | D252: 145 | E252: =C252+D252 -> 4977.4
A253: 16.3.22 | B253: De R$ 451.027,57 a R$ 563.784,45 | C253: 6040.8 | D253: 181.2 | E253: =C253+D253 -> 6222
A254: 16.3.23 | B254: De R$ 563.784,46 a R$ 704.730,57 | C254: 7551.6 | D254: 226.5 | E254: =C254+D254 -> 7778.1
A255: 16.3.24 | B255: Acima de R$ 704.730,57 | C255: 7655.3 | D255: 229.7 | E255: =C255+D255 -> 7885
A256: 16.3.25 | B256: Os emolumentos do registro do contrato de promessa de compra e venda serão os mesmos do item 16.3, reduzidos em cinquenta por cento. | C256: Informar Valor da Transação
A258: 16.4 | B258: Registro de atos sem valor declarado, incluída a primeira certidão | C258: 47.6 | D258: 1.4 | E258: =C258+D258 -> 49
A260: 16.5 | B260: Registro de loteamento ou desmembramento urbano ou rural, pelo processamento, registro na matrícula de origem e a certidão respectiva – emolumentos por unidade, limitado ao valor máximo do art. 37 desta Lei. (Alterado pela Lei nº 9.490, de 04/11/11) | C260: 71.4 | D260: 2.1 | E260: =C260+D260 -> 73.5
A262: 16.6 | B262: Registro de incorporação imobiliária, pelo processamento, registro na matrícula de origem e a certidão respectiva – emolumentos por unidade, limitado ao valor máximo do art. 37 desta Lei. (Alterado pela Lei nº 9.490, de 04/11/11) | C262: 71.4 | D262: 2.1 | E262: =C262+D262 -> 73.5
A264: 16.7 | B264: Registro de convenção de condomínio, qualquer que seja o número de unidades, incluído o valor das averbações necessárias. (Alterado pela Lei nº 9.490, de 04/11/11) | C264: 142.8 | D264: 4.3 | E264: =C264+D264 -> 147.1
A266: 16.7.1 | B266: Registro de especificação e instituição de condomínio, independente do número de unidades. (Incluído pela Lei nº 9.490, de 04/11/11) | C266: 71.4 | D266: 2.1 | E266: =C266+D266 -> 73.5
A268: 16.8 | B268: Pelo registro de pacto antenupcial | C268: 50 | D268: 1.5 | E268: =C268+D268 -> 51.5
A270: 16.9 | B270: Pelos registros torrens com valor declarado:
A271: 16.9.1 | B271: Ate R$ 5.200,00 | C271: 30.9 | D271: 0.9 | E271: =C271+D271 -> 31.8
A272: 16.9.2 | B272: De R$ 5.200,01 a R$ 6.500,00 | C272: 35.1 | D272: 1.1 | E272: =C272+D272 -> 36.2
A273: 16.9.3 | B273: De R$ 6.500,01 a R$ 8.125,00 | C273: 43.4 | D273: 1.3 | E273: =C273+D273 -> 44.7
A274: 16.9.4 | B274: De R$ 8.125,01 a R$ 10.156,25 | C274: 54.2 | D274: 1.6 | E274: =C274+D274 -> 55.8
A275: 16.9.5 | B275: De R$ 10.156,26 a R$ 12.695,31 | C275: 67.8 | D275: 2 | E275: =C275+D275 -> 69.8
A276: 16.9.6 | B276: De R$ 12.695,32 a R$ 15.869,13 | C276: 85.1 | D276: 2.6 | E276: =C276+D276 -> 87.7
A277: 16.9.7 | B277: De R$ 15.869,14 a R$ 19.836,41 | C277: 106.6 | D277: 3.2 | E277: =C277+D277 -> 109.8
A278: 16.9.8 | B278: De R$ 19.836,42 a R$ 24.795,51 | C278: 132.8 | D278: 4 | E278: =C278+D278 -> 136.8
A279: 16.9.9 | B279: De R$ 24.795,52 a R$ 30.994,39 | C279: 166 | D279: 5 | E279: =C279+D279 -> 171
A280: 16.9.10 | B280: De R$ 30.994,40 a R$ 38.742,98 | C280: 207.8 | D280: 6.2 | E280: =C280+D280 -> 214
A281: 16.9.11 | B281: De R$ 38.742,99 a R$ 48.428,72 | C281: 259.5 | D281: 7.8 | E281: =C281+D281 -> 267.3
A282: 16.9.12 | B282: De R$ 48.428,73 a R$ 60.535,90 | C282: 324.4 | D282: 9.7 | E282: =C282+D282 -> 334.1
A283: 16.9.13 | B283: De R$ 60.535,91 a R$ 75.669,87 | C283: 405.4 | D283: 12.2 | E283: =C283+D283 -> 417.6
A284: 16.9.14 | B284: De R$ 75.669,88 a R$ 94.587,33 | C284: 506.6 | D284: 15.2 | E284: =C284+D284 -> 521.8
A285: 16.9.15 | B285: De R$ 94.587,34 a R$ 118.234,16 | C285: 633.4 | D285: 19 | E285: =C285+D285 -> 652.4
A286: 16.9.16 | B286: De R$ 118.234,17 a R$ 147.792,71 | C286: 791.7 | D286: 23.8 | E286: =C286+D286 -> 815.5
A287: 16.9.17 | B287: De R$ 147.792,72 a R$ 184.740,89 | C287: 989.9 | D287: 29.7 | E287: =C287+D287 -> 1019.6
A288: 16.9.18 | B288: De R$ 184.740,90 a R$ 230.926,11 | C288: 1237 | D288: 37.1 | E288: =C288+D288 -> 1274.1
A289: 16.9.19 | B289: De R$ 230.926,12 a R$ 288.657,64 | C289: 1546.5 | D289: 46.4 | E289: =C289+D289 -> 1592.9
A290: 16.9.20 | B290: De R$ 288.657,65 a R$ 360.822,05 | C290: 1932.8 | D290: 58 | E290: =C290+D290 -> 1990.8
A291: 16.9.21 | B291: De R$ 360.822,06 a R$ 451.027,56 | C291: 2416.2 | D291: 72.5 | E291: =C291+D291 -> 2488.7
A292: 16.9.22 | B292: De R$ 451.027,57 a R$ 563.784,45 | C292: 3020.5 | D292: 90.6 | E292: =C292+D292 -> 3111.1
A293: 16.9.23 | B293: De R$ 563.784,46 a R$ 704.730,57 | C293: 3775.8 | D293: 113.3 | E293: =C293+D293 -> 3889.1
A294: 16.9.24 | B294: Acima de R$ 704.730,57 | C294: 3828.9 | D294: 114.9 | E294: =C294+D294 -> 3943.8
A296: 16.10 | B296: Pelo registro completo de emissão de debêntures, serão cobrados os mesmos emolumentos do item 16.3 e de seus subitens. | C296: Informar Valor da Transação
A298: 16.11 | B298: Pelo registro completo de bens de família (sobre o valor do bem):
A299: 16.11.1 | B299: Ate R$ 5.200,00 | C299: 12.4 | D299: 0.4 | E299: =C299+D299 -> 12.8
A300: 16.11.2 | B300: De R$ 5.200,01 a R$ 6.500,00 | C300: 14.1 | D300: 0.4 | E300: =C300+D300 -> 14.5
A301: 16.11.3 | B301: De R$ 6.500,01 a R$ 8.125,00 | C301: 17.4 | D301: 0.5 | E301: =C301+D301 -> 17.9
A302: 16.11.4 | B302: De R$ 8.125,01 a R$ 10.156,25 | C302: 21.7 | D302: 0.7 | E302: =C302+D302 -> 22.4
A303: 16.11.5 | B303: De R$ 10.156,26 a R$ 12.695,31 | C303: 27.1 | D303: 0.8 | E303: =C303+D303 -> 27.9
A304: 16.11.6 | B304: De R$ 12.695,32 a R$ 15.869,13 | C304: 34 | D304: 1 | E304: =C304+D304 -> 35
A305: 16.11.7 | B305: De R$ 15.869,14 a R$ 19.836,41 | C305: 42.6 | D305: 1.3 | E305: =C305+D305 -> 43.9
A306: 16.11.8 | B306: De R$ 19.836,42 a R$ 24.795,51 | C306: 53.1 | D306: 1.6 | E306: =C306+D306 -> 54.7
A307: 16.11.9 | B307: De R$ 24.795,52 a R$ 30.994,39 | C307: 66.4 | D307: 2 | E307: =C307+D307 -> 68.4
A308: 16.11.10 | B308: De R$ 30.994,40 a R$ 38.742,98 | C308: 83.1 | D308: 2.5 | E308: =C308+D308 -> 85.6
A309: 16.11.11 | B309: De R$ 38.742,99 a R$ 48.428,72 | C309: 103.8 | D309: 3.1 | E309: =C309+D309 -> 106.9
A310: 16.11.12 | B310: De 48.428,73 a R$ 60.535,90 | C310: 129.8 | D310: 3.9 | E310: =C310+D310 -> 133.7
A311: 16.11.13 | B311: De R$ 60.535,91 a R$ 75.669,87 | C311: 162.2 | D311: 4.9 | E311: =C311+D311 -> 167.1
A312: 16.11.14 | B312: De R$ 75.669,88 a R$ 94.587,33 | C312: 202.7 | D312: 6.1 | E312: =C312+D312 -> 208.8
A313: 16.11.15 | B313: De R$ 94.587,34 a R$ 118.234,16 | C313: 253.3 | D313: 7.6 | E313: =C313+D313 -> 260.9
A314: 16.11.16 | B314: De R$ 118.234,17 a R$ 147.792,71 | C314: 316.7 | D314: 9.5 | E314: =C314+D314 -> 326.2
A315: 16.11.17 | B315: De R$ 147.792,72 a R$ 184.740,89 | C315: 396 | D315: 11.9 | E315: =C315+D315 -> 407.9
A316: 16.11.18 | B316: De R$ 184.740,90 a R$ 230.926,11 | C316: 494.8 | D316: 14.8 | E316: =C316+D316 -> 509.6
A317: 16.11.19 | B317: De R$ 230.926,12 a R$ 288.657,64 | C317: 618.7 | D317: 18.6 | E317: =C317+D317 -> 637.3
A318: 16.11.20 | B318: De R$ 288.657,65 a R$ 360.822,05 | C318: 773.2 | D318: 23.2 | E318: =C318+D318 -> 796.4
A319: 16.11.21 | B319: De R$ 360.822,06 a R$ 451.027,56 | C319: 966.5 | D319: 29 | E319: =C319+D319 -> 995.5
A320: 16.11.22 | B320: De R$ 451.027,57 a R$ 563.784,45 | C320: 1208.2 | D320: 36.2 | E320: =C320+D320 -> 1244.4
A321: 16.11.23 | B321: De R$ 563.784,46 a R$ 704.730,57 | C321: 1510.3 | D321: 45.3 | E321: =C321+D321 -> 1555.6
A322: 16.11.24 | B322: Acima de R$ 704.730,57 | C322: 1531.5 | D322: 45.9 | E322: =C322+D322 -> 1577.4
A324: 16.12 | B324: Inscrição, registro ou averbação de penhora (sobre o valor do bem ou da execução se for menor e, não constando, sobre o valor da causa), os emolumentos serão os do item 16.11, aplicando-se a regra do item 16.31 | C324: Informar Valor da Transação
A326: 16.13 | B326: Pelo registro de cédula de crédito rural, do produto rural e demais de natureza rural no livro 3 do Registro de Imóveis, conforme Lei de Registros Públicos | C326: 142.8 | D326: 4.3 | E326: =C326+D326 -> 147.1
A327: 16.13.1 | B327: Por cada registro de cédula de crédito rural, do produto rural e demais de natureza rural e/ou gravame decorrente no livro 2 do Registro de Imóveis, conforme Lei de Registros Públicos | C327: 71.4 | D327: 2.1 | E327: =C327+D327 -> 73.5
A328: 16.13.2 | B328: Averbações de cédula de natureza rural | C328: 71.4 | D328: 2.1 | E328: =C328+D328 -> 73.5
A330: 16.14 | B330: Pelo registro de cédula de crédito industrial, comercial, de crédito bancário e de crédito à exportação que não sejam de natureza rural, no livro 3 do Cartório de Registros de Imóveis, conforme Lei de Registros Públicos, os emolumentos serão os mesmos do item 16.9 | C330: Informar Valor da Transação
A331: 16.14.1 | B331: Pelo registro da cédula de crédito industrial, comercial, de crédito bancário e de crédito a exportação, que não sejam de natureza rural e/ou gravame decorrente no livro 2 do Cartório de Registros de Imóveis, conforme Lei de Registros Públicos, os emolumentos serão os mesmos do item 16.9 | C331: Informar Valor da Transação
A332: 16.14.2 | B332: Averbações de cédula de crédito industrial, comercial, de crédito bancário e de crédito à exportação que não seja de natureza rural. | C332: 142.8 | D332: 4.3 | E332: =C332+D332 -> 147.1
A334: 16.15 | B334: Revogado pela Lei nº 9.490, de 04/11/11, pub.D.O. 04/11/11 | C334: Orientação Informativa
A335: 16.15.1 | B335: Revogado pela Lei nº 9.490, de 04/11/11, pub.D.O. 04/11/11 | C335: Orientação Informativa
A337: 16.16 | B337: Ao registro e à averbação referentes à aquisição da casa própria, em que seja parte cooperativa habitacional ou entidade assemelhada, serão considerados, para efeito de cálculo, de emolumentos, como um ato apenas, de acordo com o disposto no § 1º do art. 290, da Lei nº 6.015, de 31 de dezembro de 1973:
A338: 16.16.1 | B338: Até R$ 10.000,00 | C338: 12 | D338: 0.4 | E338: =C338+D338 -> 12.4
A339: 16.16.2 | B339: De R$ 10.000,01 a R$ 20.000,00 | C339: 17.8 | D339: 0.5 | E339: =C339+D339 -> 18.3
A340: 16.16.3 | B340: De R$ 20.000,01 a R$ 40.000,00 | C340: 35.7 | D340: 1.1 | E340: =C340+D340 -> 36.8
A341: 16.16.4 | B341: De R$ 40.000,01 a R$ 80.000,00 | C341: 71.4 | D341: 2.1 | E341: =C341+D341 -> 73.5
A342: 16.16.5 | B342: De R$ 80.000,01 a R$ 160.000,00 | C342: 142.8 | D342: 4.3 | E342: =C342+D342 -> 147.1
A343: 16.16.6 | B343: Acima de R$ 160.000,00 | C343: 166.7 | D343: 5 | E343: =C343+D343 -> 171.7
A345: 16.17 | B345: Nos demais programas de interesse social, executados pelas Companhias de Habitação Popular - COHABs ou entidades assemelhadas, o valor dos emolumentos e das custas devidos por atos de aquisição de imóveis e de averbação de construção conforme § 2º do art. 290, da Lei nº 6.015, de 31 de dezembro de 1973, serão de | C345: 41.7 | D345: 1.3 | E345: =C345+D345 -> 43
A347: 16.18 | B347: Os emolumentos devidos ao Registro de Imóveis, nos atos relacionados com à aquisição imobiliária para fins residenciais, oriunda de programas e convênios com a União, Estados, Distrito Federal e Municípios, para a construção de habitações populares destinadas a famílias de baixa renda, pelo sistema de mutirão e autoconstrução orientada, serão reduzidos a vinte por cento da tabela cartorária normal, considerando o imóvel será limitado a até sessenta e nove metros quadrados de área construída, em terreno de até duzentos e cinquenta metros quadrados. (§ 4º do art. 290 da Lei nº 6.015, de 31 de dezembro de 1973). | C347: Orientação Informativa
A349: 16.19 | B349: Os emolumentos devidos por atos de abertura de matrícula, registro de incorporação, parcelamento do solo, averbação de construção, instituição de condomínio, registro da carta de habite-se e demais atos referentes à construção de empreendimentos no âmbito do Programa Minha Casa Minha Vida (Lei nº 11.997, de 7 de julho de 2009) serão reduzidos em:
A350: 16.19.1 | B350: Noventa por cento para a construção de unidades habitacionais de até R$ 60.000,00 (sessenta mil reais). | C350: Orientação Informativa
A351: 16.19.2 | B351: Oitenta por cento para a construção de unidades habitacionais de R$ 60.000,01 (sessenta mil reais e um centavo) a R$ 80.000,00 (oitenta mil reais). | C351: Orientação Informativa
A352: 16.19.3 | B352: Setenta e cinco por cento para a construção de unidades habitacionais de R$ 80.000,01 (oitenta mil reais e um centavo) a R$ 130.000,00 (cento e trinta mil reais). | C352: Orientação Informativa
A355: 16.20 | B355: A escritura pública exigida ao registro da alienação de imóvel e de correspondentes garantias reais e aos demais atos relativos ao primeiro imóvel residencial adquirido ou financiado pelo beneficiário no âmbito do Programa Minha Casa Minha Vida (Lei nº 11.997, de 7 de julho de 2009) terão os emolumentos reduzidos em:
A356: 16.20.1 | B356: Oitenta por cento para os imóveis residenciais destinados a beneficiário com renda familiar mensal de valor compreendido de seis a dez salários mínimos. | C356: Informar Valor da Transação
A357: 16.20.2 | B357: Noventa por cento para os imóveis residenciais forem destinados a beneficiário com renda familiar mensal superior a três e igual ou inferior a seis salários mínimos. | C357: Informar Valor da Transação
A359: 16.21 | B359: O descumprimento do disposto nos itens 16.19 e 16.20 e seus subitens sujeitarão os registradores e notário à multa no valor de até R$ 100.000,00 (cem mil reais), bem como a outras sanções previstas na Lei nº 8.935, de 18 de novembro de 1994. | C359: Orientação Informativa
A361: 16.22 | B361: Averbação:
A362: 16.22.1 | B362: De ato de qualquer natureza com valor declarado, os emolumentos serão os do item 16.9 | C362: Informar Valor da Transação
A363: 16.22.2 | B363: De ato sem valor declarado | C363: 39.3 | D363: 1.2 | E363: =C363+D363 -> 40.5
A364: 16.22.3 | B364: Das unidades integrantes do condomínio, os emolumentos serão os mesmos do item 16.9 | C364: Informar Valor da Transação
A365: 16.22.4 | B365: De georreferenciamento | C365: 264.9 | D365: 7.9 | E365: =C365+D365 -> 272.8
A366: 16.22.5 | B366: Cancelamento de averbação | C366: 39.3 | D366: 1.2 | E366: =C366+D366 -> 40.5
A368: 16.23 | B368: Pela intimação de promissório comprador de imóvel ou qualquer outra intimação em cumprimento de lei ou de determinação judicial | C368: 23.8 | D368: 0.7 | E368: =C368+D368 -> 24.5
A370: 16.24 | B370: Das certidões:
A371: 16.24.1 | B371: Com uma folha | C371: 23.8 | D371: 0.7 | E371: =C371+D371 -> 24.5
A372: 16.24.2 | B372: Por folha acrescida além da primeira, mais | C372: 4.8 | D372: 0.1 | E372: =C372+D372 -> 4.9
A373: 16.24.3 | B373: Por pessoa acrescida na certidão, que não sejam marido e mulher, representante e representado, mais | C373: 4.8 | D373: 0.1 | E373: =C373+D373 -> 4.9
A375: 16.25 | B375: Das buscas:
A376: 16.25.1 | B376: Até dois anos | C376: 3.6 | D376: 0.1 | E376: =C376+D376 -> 3.7
A377: 16.25.2 | B377: Até cinco anos | C377: 5.9 | D377: 0.2 | E377: =C377+D377 -> 6.1
A378: 16.25.3 | B378: Até dez anos | C378: 9.5 | D378: 0.3 | E378: =C378+D378 -> 9.8
A379: 16.25.4 | B379: Até quinze anos | C379: 12 | D379: 0.4 | E379: =C379+D379 -> 12.4
A380: 16.25.5 | B380: Até vinte anos | C380: 15.5 | D380: 0.5 | E380: =C380+D380 -> 16
A381: 16.25.6 | B381: Até trinta anos | C381: 20.2 | D381: 0.6 | E381: =C381+D381 -> 20.8
A382: 16.25.7 | B382: Até cinquenta anos | C382: 23.8 | D382: 0.7 | E382: =C382+D382 -> 24.5
A383: 16.25.8 | B383: Acima de cinquenta anos | C383: 30.9 | D383: 0.9 | E383: =C383+D383 -> 31.8
A384: 16.25.9 | B384: Se indicados dia, mês e ano da prática do ato, não serão cobradas buscas. | C384: Orientação Informativa
A386: 16.26 | B386: Considera-se sem valor declarado, entre outros, as averbações referentes a separação judicial e divórcio, casamento, quitação de débito, demolição e unificação de imóveis. | C386: Orientação Informativa
A388: 16.27 | B388: O registro de ato será calculado com base no valor declarado ou com base na avaliação oficial da Fazenda Pública, o que for maior ou, ainda, pelo preço de mercado, caso a avaliação não seja exigível ou for com este incompatível. (Alterado pela Lei nº 9.490, de 04/11/11) | C388: Orientação Informativa
A390: 16.28 | B390: Nos condomínios de plano horizontal, considera-se uma só unidade autônoma o apartamento e as garagens que o servem. | C390: Orientação Informativa
A392: 16.29 | B392: Realizando-se mais de um registro ou averbação em razão do mesmo título apresentado, os emolumentos serão cobrados separadamente, salvo disposição desta lei em contrário. | C392: Orientação Informativa
A394: 16.30 | B394: Revogado pela Lei nº 9.490, de 04/11/11, pub. D.O.04/11/11 | C394: Orientação Informativa
A396: 16.31 | B396: No registro de gravames como hipoteca, penhor e alienação fiduciária, quando dois ou mais imóveis forem dados em garantia; ou no caso de penhor, quando a garantia esteja estipulada em mais de um imóvel, na mesma circunscrição imobiliária ou não, tenham ou não igual valor, a base de cálculo para cobrança, em relação a cada um dos registros, será o valor do mútuo dividido pelo número de imóveis dados em garantia, ou pelo número de imóveis de situação, conforme o caso, desde que decorrentes do mesmo título, limitados os emolumentos ao valor máximo do art. 37 desta Lei, por circunscrição. (Alterado pela Lei nº 9.490, de 04/11/11) | C396: Orientação Informativa
A398: 16.32 | B398: Para efeito de cobrança de emolumentos, as averbações e os registros realizados com base no art. 237-A da Lei nº 6.015, de 31 de dezembro de 1973, serão considerados como ato de registro único, não importando a quantidade de unidades autônomas envolvidas ou de atos intermediários existentes. | C398: Orientação Informativa
A400: 16.33 | B400: Quando do registro de loteamento, desmembramento ou incorporação imobiliária, o Oficial deverá, desde logo, abrir matrícula específica para cada unidade, indicando como proprietário o próprio titular da área loteada, desmembrada ou incorporada, fazendo-se as remissões recíprocas. (Incluído pela Lei nº 9.490, de 04/11/11) | C400: Orientação Informativa
A402: TABELA XVII
A403: DOS SERVIÇOS EXTRAJUDCIAIS – DOS ATOS DO TABELIONATO DE PROTESTOS
A405: 17.1 | B405: Protesto de título de crédito (sobre o valor do título):
A406: 17.1.1 | B406: Até R$ 260,00 | C406: 14.3 | D406: 0.4 | E406: =C406+D406 -> 14.7
A407: 17.1.2 | B407: De R$ 260,01 a R$ 530,00 | C407: 28.6 | D407: 0.9 | E407: =C407+D407 -> 29.5
A408: 17.1.3 | B408: De R$ 530,01 a R$ 1.058,20 | C408: 44.1 | D408: 1.3 | E408: =C408+D408 -> 45.4
A409: 17.1.4 | B409: De R$ 1.058,21 a R$ 2.203,50 | C409: 65.5 | D409: 2 | E409: =C409+D409 -> 67.5
A410: 17.1.5 | B410: De R$ 2.203,51 a R$ 4.408,30 | C410: 104.8 | D410: 3.1 | E410: =C410+D410 -> 107.9
A411: 17.1.6 | B411: Acima de R$ 4.408,30 | C411: 163.1 | D411: 4.9 | E411: =C411+D411 -> 168
A413: 17.2 | B413: Intimação ou edital por título, não incluídos os custos da publicação pela imprensa e postal, se houver. (Alterado pela Lei nº 9.490, de 04/11/11) | C413: 4.8 | D413: 0.1 | E413: =C413+D413 -> 4.9
A415: 17.3 | B415: Averbação de documento que determine alteração ou cancelamento de protestos ou de quitação, com ou sem valor econômico | C415: 15.5 | D415: 0.5 | E415: =C415+D415 -> 16
A417: 17.4 | B417: Quando, após o apontamento e antes ou depois da intimação, ocorrer a liquidação do título ou a desistência do protesto, os emolumentos serão de:
A418: 17.4.1 | B418: Até R$ 260,00 | C418: 8.4 | D418: 0.3 | E418: =C418+D418 -> 8.7
A419: 17.4.2 | B419: De R$ 260,01 a R$ 530,00 | C419: 16.7 | D419: 0.5 | E419: =C419+D419 -> 17.2
A420: 17.4.3 | B420: De R$ 530,01 a R$ 1.058,20 | C420: 26.2 | D420: 0.8 | E420: =C420+D420 -> 27
A421: 17.4.4 | B421: De R$ 1.058,21 a R$ 2.203,50 | C421: 39.3 | D421: 1.2 | E421: =C421+D421 -> 40.5
A422: 17.4.5 | B422: De R$ 2.203,51 a R$ 4.408,30 | C422: 63 | D422: 1.9 | E422: =C422+D422 -> 64.9
A423: 17.4.6 | B423: Acima de R$ 4.408,30 | C423: 98.9 | D423: 3 | E423: =C423+D423 -> 101.9
A425: 17.5 | B425: Das certidões:
A426: 17.5.1 | B426: Com uma folha | C426: 23.8 | D426: 0.7 | E426: =C426+D426 -> 24.5
A427: 17.5.2 | B427: Por folha acrescida além da primeira, mais | C427: 4.8 | D427: 0.1 | E427: =C427+D427 -> 4.9
A428: 17.5.3 | B428: Por pessoa acrescida na certidão, que não sejam marido e mulher, representante e representado, mais | C428: 4.8 | D428: 0.1 | E428: =C428+D428 -> 4.9
A429: 17.5.4 | B429: Certidão destinada a órgãos restritivos de crédito ou entidades de classe e similares - por pessoa | C429: 5.9 | D429: 0.2 | E429: =C429+D429 -> 6.1
A431: 17.6 | B431: Das buscas:
A432: 17.6.1 | B432: Até dois anos | C432: 3.6 | D432: 0.1 | E432: =C432+D432 -> 3.7
A433: 17.6.2 | B433: Até cinco anos | C433: 5.9 | D433: 0.2 | E433: =C433+D433 -> 6.1
A434: 17.6.3 | B434: Até dez anos | C434: 9.5 | D434: 0.3 | E434: =C434+D434 -> 9.8
A435: 17.6.4 | B435: Até quinze anos | C435: 12 | D435: 0.4 | E435: =C435+D435 -> 12.4
A436: 17.6.5 | B436: Até vinte anos | C436: 15.5 | D436: 0.5 | E436: =C436+D436 -> 16
A437: 17.6.6 | B437: Até trinta anos | C437: 20.2 | D437: 0.6 | E437: =C437+D437 -> 20.8
A438: 17.6.7 | B438: Até cinquenta anos | C438: 23.8 | D438: 0.7 | E438: =C438+D438 -> 24.5
A439: 17.6.8 | B439: Acima de cinquenta anos | C439: 30.9 | D439: 0.9 | E439: =C439+D439 -> 31.8
A440: 17.6.9 | B440: Se indicados dia, mês e ano da prática do ato, não serão cobradas buscas.
A442: 17.7 | B442: Distribuição extrajudicial de títulos para protesto. (Alterado pela Lei nº 9.490, de 04/11/11) | C442: 5.3 | D442: 0.2 | E442: =C442+D442 -> 5.5
A443: 17.7.1 | B443: Não estão sujeitos à distribuição os títulos rurais. | C443: Orientação Informativa
A444: 17.7.2 | B444: Não estão sujeitos à nova distribuição os títulos cujos protestos tenham sido sustados por ordem judicial ou os evitados pelo devedor por motivo legal ou, ainda, os devolvidos ao apresentador por falta de requisito formal. | C444: Orientação Informativa
A445: 17.7.3 | B445: Efetuada a distribuição, será entregue ao apresentante recibo com as características do título e a indicação do tabelionato para o qual foi distribuído, bem como dos emolumentos recebidos. | C445: Orientação Informativa
A446: 17.7.4 | B446: O serviço de distribuição deverá efetuar as baixas das distribuições e expedir as certidões correspondentes no prazo de dois dias úteis, sendo os emolumentos os dos itens 17.5 e 17.6 | C446: Orientação Informativa
A447: 17.7.5 | B447: O serviço de distribuição não fornecerá certidão de ocorrência de distribuição, na qual conste averbação de baixa, salvo se a pedido escrito do próprio devedor ou por determinação judicial. | C447: Orientação Informativa
A448: 17.8 | B448: Serão isentos de emolumentos desta tabela os atos praticados em obediência a ordem judicial. | C448: Orientação Informativa